id,count,value
180562885329138_1269371046448311,1959,pastor suspeito de estuprar enteado chora e se defende em video na web felipe heiderich contou que tomou antidepressivos so queria dormir pastor disse que sua inocencia esta praticamente estabelecida
180562885329138_1267891373262945,408,mp quer que denunciados por trens parados devolvam r  milhoes mesmo com obras paradas governo de sp comprou trens para linha  segundo promotor  composicoes foram comprados por r  milhoes
180562885329138_1266853096700106,2676,filho de homem que roubou arma e matou pm e solto em goias segundo a policia pai atirou para evitar que caseiro fosse detido video mostra quando atirador pega arma do coldre e dispara assista
180562885329138_1266714666713949,2608,pastor suspeito de abuso contra enteado deixa prisao no rio justica concedeu alvara de soltura de felipe mesmo sem tornozeleiras ele foi denunciado pelo ministerio publico por estupro de vulneravel
180562885329138_1265330180185731,1558,pastor acusado de abusar de enteado no rio respondera em liberdade felipe heiderich usara tornozeleira e devera ficar longe da vitima e da mae vitima que tem  anos e filho da pastora bianca toledo mulher do
180562885329138_1261406127244803,459,dez presos na operacao boca livre sao liberados diz pf eles estavam detidos desde tercafeira  em sao paulo grupo e suspeito de desviar recursos federais em projetos da lei rouanet
180562885329138_1259921977393218,668,exprefeita de bom jardim passa a cumprir pena em regime domiciliar lidiane leite teve o uso tornozeleira eletronica substituido pelo recolhimento decisao da justica federal diz que ela deve ficar em casa durante a
180562885329138_1259756107409805,2252,homem invade festa de aniversario abusa de  criancas e e preso em mt segundo a policia ele abusou das criancas dentro do pulapula da festa suspeito alegou que estava embriagado e nao se lembrava dos abusos
180562885329138_1259392960779453,499,novas tarifas de pedagio em estradas de sp entram em vigor nesta sexta no sistema anchietaimigrantes pedagio sobe de r  para r  rodovia dos tamoios vai passar a cobrar pedagio veja precos
180562885329138_1258160517569364,748,justica federal autoriza liberacao de exministro paulo bernardo e mais juiz disse que nao tem convenio para uso de tornozeleira segundo mpf petista se beneficiou de esquema de desvio milionario
180562885329138_1258143124237770,1560,senado aprova reajuste salarial para servidores do judiciario e do mpu textos dao aumento de ate  a judiciario e  a servidores do mpu impacto neste ano sera de r  bi governo diz que ha previsao no orcamento
180562885329138_1257270647658351,2074,veja show de sertanejo em casamento que teria sido pago com lei rouanet empresario de leo rodriguez disse que nao sabia que dinheiro era ilegal imagens mostram casal subindo ao palco durante show do cantor
180562885329138_1253697171349032,674,apos deixar cadeia cervero sorri para camera em aviao assista ao video exdiretor da petrobras estava detido no parana desde janeiro de   ele vai cumprir pena em regime domiciliar em itaipava no rio de janeiro
180562885329138_1253065608078855,951,jogador jobson e preso suspeito de estuprar adolescentes no para atleta e suspeito de estuprar quatro adolescentes de conceicao do araguaia exatacante do botafogo e investigado ainda por um quinto caso de estupro
180562885329138_1253102841408465,173,promotor que citou melhor parte em estupro nega desrespeito em prova em nota alexandre couto joppert disse que frase nao teve intencao de menosprezar vitimas expressao foi usada em prova de concurso publico
180562885329138_1252242298161186,1400,exercito diz que onca morta nao era protagonista de tour da tocha no am exercito disse que juma participou de revezamento por coincidencia cma nega que onca estaria estressada por conta do evento da tocha
180562885329138_1251534808231935,933,lutador e preso no am por espancar namorada e alega legitima defesa bruno augusto almeida foi preso apos se apresentar a delegacia da mulher em depoimento ele alegou defesa e disse que briga iniciou por ciumes
180562885329138_1251417841576965,7728,erramos diz rio  apos morte de onca presente em tour da tocha animal que participou de evento no am escapou e foi morto por militares cena contraria nossas crencas e valores disse organizacao de jogos
180562885329138_1250974284954654,1254,juiza nega indenizacao apos abuso no metro e diz que mulher nada fez suspeito foi detido em vagao de trem na linha vermelha de sao paulo advogada de passageira diz que vai recorrer da decisao
180562885329138_1250162475035835,305,dois suspeitos da invasao a hospital no rio sao identificados policia analisa imagens de cameras do hospital pm diz que grupo tinha aproximadamente  homens
180562885329138_1247975561921193,770,falso professor de computacao e preso suspeito de estuprar  menores homem de  anos levava meninas e meninos de  a  anos para casa vitimas sofreram abuso sexual diz delegada suspeito negou a policia
180562885329138_1246639942054755,1250,medico e filmado discutindo com casal de lesbicas gay tem que matar agente de turismo e namorada denunciaram caso a policia em goiania homem disse que tinha bebido e nao lembra de ter falado em morte
180562885329138_1246605165391566,44,tce recomenda aprovacao das contas de  do governo alckmin relator diz que nao ter tido tempo para analisar prejuizo causado ao metro inflacao e economia impactaram na arrecadacao do estado apontou voto
180562885329138_1241891812529568,4781,dinheiro publico foi convertido em sapatos e roupas de grife diz mpf declaracao e sobre gastos da mulher de eduardo cunha claudia cruz mpf diz que dinheiro gasto por ela tinha origem em propina para cunha
180562885329138_1241570432561706,1438,policia prende  pessoas envolvidas no caso meninas de guarus juiza condenou  por exploracao e estupro de criancas e adolescentes  exvereadores e o exdeputado nelson nahim estao entre os presos
180562885329138_1241116082607141,1566,prefeito proibe entrada de filhos com maes desempregadas em creche video mostra mae de gemeos barrada em doresopolis mg prefeito alega contencao de gastos mais de  criancas estao impedidas
180562885329138_1241052992613450,1037,cameras filmam taxista jogando ovo em carro do uber no centro do rio imagens exclusivas do rjtv mostram momento do ataque  motorista e taxista brigaram proximo ao terminal rodoviario
180562885329138_1240773532641396,1822,vitimas de estupro vivem clausura e banda new hit espera nova sentenca prestes a completar  anos caso de violencia coletiva segue sem resolucao integrantes foram condenados mas aguardam recursos em liberdade
180562885329138_1239604749424941,571,pai gera revolta ao dizer que filho condenado por estupro pagara preco alto por ato de  minutos brock turner foi condenado a seis meses de prisao por abusar sexualmente de mulher enquanto ela estava inconsciente promotoria disse que pena nao
180562885329138_1239545049430911,563,dj e preso em sp suspeito de estuprar mulheres apos falsa oferta de trabalho homem usava rede sociais para chamar jovens que trabalham em eventos taxista tambem foi preso apos denuncia de estupro de uma passageira
180562885329138_1239155649469851,84,instagram muda para destacar posts de perfis mais curtidos por usuario fotos e videos de amigos ou contas muito curtidas serao exibidos primeiro esta e a maior mudanca no instagram desde que ele foi lancado em
180562885329138_1236807183038031,4246,professora e investigada por omissao em caso de agressao a crianca no rs cameras flagraram maustratos praticados por funcionaria em canoas caso ocorreu em creche colega sabia das agressoes diz delegado
180562885329138_1234772463241503,768,macarrao condenado no caso eliza consegue beneficio do semiaberto para ter um trabalho externo ele ainda precisa ser transferido de unidade macarrao foi condenado a  anos de prisao por homicidio qualificado
180562885329138_1232885516763531,2782,transexual crucificada usara representacao da biblia na parada gay viviany beleboni usara roupa com duas balancas que simbolizam a justica parada do orgulho lgbt comeca as h deste domingo na av paulista
180562885329138_1232496790135737,487,suspeito de envolvimento em estupro e liberado apos depoimento a policia homem que nao teve identidade divulgada foi detido em operacao da pm depois de prestar depoimento na tarde deste sabado ele foi liberado
180562885329138_1232193650166051,196,jovem vai a policia e se diz autor de video com adolescente no rio rapaz admitiu ter divulgado imagens de menor mas negou estupro vitima de  anos afirmou a policia ter sido abusada por  homens
180562885329138_1231227043596045,3014,suspeito de divulgar imagem alega que nao sabia de estupro de jovem estudante e um dos quatro que foram identificados pela policia do rio policia investiga estupro de adolescente por pelo menos  homens
180562885329138_1230712566980826,1026,ranking da ponto a aluno por tipo de mulher que  pegar durante interufg lista avalia beleza cor da pele e estado civil internautas repudiam ato segundo publicacao rapaz que ficar com um travesti sera eliminado
180562885329138_1230691693649580,6048,mulher grava video de agressao a  cadela e policia civil vai apurar o caso caso de maustratos aconteceu na quartafeira  indignados integrantes de grupo de protecao animal registraram um bo
180562885329138_1228557720529644,308,video mostra prisao de suspeito de abusar de mulher no metro de sp homem foi detido por volta das h desta segunda  na linha vermelha no mesmo horario outro suspeito foi preso em trecho diferente da linha
180562885329138_1225002194218530,49,motoristas de onibus anunciam nova paralisacao a partir das h categoria cobra reajuste acima dos  oferecidos protestos comecaram na quartafeira nos  terminais da cidade
180562885329138_1224356750949741,326,um ano apos estupro coletivo g ouve garotos condenados pelo crime g entrou no cem com autorizacao de juiz e conversou com os adolescentes crime cometido contra quatro garotas aconteceu em maio do ano passado
180562885329138_1222116417840441,1183,condenado por cotovelada fala pela a vez sobre caso fiquei em choque anderson de oliveira foi preso apos agredir auxiliar de producao em  morro de medo dele e nao perdoo diz vitima que mora em sao roque
180562885329138_1220225108029572,278,ataque hacker whatsapp gratis marco civil da internet ganha regras decreto presidencial regulamentou  das questoes mais polemicas da lei fixadas brechas a neutralidade de rede e seguranca sobre dado pessoal
180562885329138_1219409368111146,131,apos fim de multa na conta sabesp sobe tarifa da agua e esgoto em nova tarifa usa ipca como base e comeca a valer nesta quintafeira  desde  empresa arrecadou r  milhoes com tarifa de contingencia
180562885329138_1218874298164653,2464,no auditorio o laicismo ficou de fora o auditorio vereador aarao steinbruch no terreo da camara tem capacidade para  espectadores e e requisitado pelos vereadores para eventos voltad
180562885329138_1218128468239236,568,carro preto e depredado em protesto de taxistas no centro de sp ato e contra decreto de haddad que autoriza aplicativos como uber manifestantes deram socos e chutes em veiculo na av  de maio
180562885329138_1216903201695096,362,condenado por cotovelada em sao roque ganha liberdade condicional anderson de oliveira foi preso apos agredir mulher em  comerciante estava preso na penitenciaria de tremembe
180562885329138_1215719481813468,334,eu bebi e dirigi diz exdeputado carli filho sobre acidente com dois mortos caso completou sete anos neste sabado  exdeputado nao foi julgado mae de um dos jovens mortos diz que carli filho deve desculpas a sociedade
180562885329138_1212565308795552,69,cobranca de posgraduacao pode ter segunda votacao na camara em maio se aprovada pec ainda passara pelo senado associacao de posgraduandos diz que acesso sera restringido
180562885329138_1212460132139403,61,apos alta iof sobre dolar em especie ainda e mais barato que no cartao custo do imposto nas compras em especie e quase  vezes menor governo elevou aliquota de  para  a partir desta tercafeira
180562885329138_1211815118870571,863,governo sobe para  iof para compra de dolar em especie segundo ministerio da fazenda medida vale a partir desta tercafeira expectativa do governo de alta anual da arrecadacao e de r  bilhoes
180562885329138_1208766859175397,4529,ela e um monstro diz marido de professora suspeita de pedofilia professora de creche em caxias foi presa com advogado quarta segundo a policia uma das vitimas e a filha do marido da professora
180562885329138_1208474475871302,5021,homem de  anos e professora de creche sao presos por pedofilia no rio segundo a policia mulher enviava fotos e videos pela internet para suspeito  advogado e contador casado e com dois filhos nega a acusacao
180562885329138_1208467632538653,909,mtst bloqueia rodovias e avenidas em sp contra o impeachment ao menos  pontos da capital e da grande sao paulo foram bloqueados objetivo da mobilizacao e denunciar o golpe em curso no pais diz mtst
180562885329138_1208136035905146,23,stf da  dias para estados entrarem em acordo sobre dividas com uniao nesse prazo estados poderao pagar menos que o exigido pelo governo ministros comecaram a discutir com voto do relator contrario aos estados
180562885329138_1206571352728281,613,empresario envolvido em batida saiu do pais apos prisao decretada diz pf documento da policia federal mostra que ele viajou no dia  de marco ele dirigia mustang em alta velocidade em aracatuba
180562885329138_1202692966449453,262,ministro defende coexistencia de internet fixa com e sem limite de uso governo quer que operadoras assinem termo garantindo os dois pacotes ameaca de limitacao no servico vem provocando polemica
180562885329138_1201936813191735,733,assembleia deixa de analisar fraude da merenda e vota projetos religiosos deputados aprovaram criacao do dia de acao de gracas nesta terca psdb pediu novamente tempo para analisar requerimentos da merenda
180562885329138_1201594486559301,1120,por falta de quorum assembleia de sp nao analisa fraude da merenda comissao de educacao nao analisou  requerimentos sobre o tema esquema pagava propina para fraudar licitacoes e beneficiar cooperativa
180562885329138_1201503683235048,369,franquia de dados na internet fixa veja perguntas e respostas empresas passaram a vender banda larga fixa com limite no uso de dados vivo se juntou em fevereiro a net e oi que fornecem servico com controle
180562885329138_1198632743522142,469,policia investiga se foto de dinheiro com funcionario da coaf seria propina imagem mostra carlos luciano lopes com macos de dinheiro vivo defesa diz que foto e brincadeira e dinheiro era para pagar funcionarios
180562885329138_1198442796874470,199,protestos contra impeachment de dilma fecham vias de sao paulo pistas da marginal tiete foram fechadas e depois liberadas segundo a cet houve atos ainda na ponte das bandeiras na imigrantes e na av paulista
180562885329138_1196379517080798,284,sabesp vai reajustar conta de agua em  a partir de maio autorizacao para o reajuste foi dada na segunda  pela arsesp tambem em maio sabesp encerra bonus e multa da agua
180562885329138_1194860303899386,604,passageiros relatam emboscadas de taxistas ao tentar usar uber em pe estudante conta que foi ofendida ao tentar seguir em carro do aplicativo sindicato dos taxistas afirmou que nao corrobora com acoes agressivas
180562885329138_1193023500749733,958,suzane von richthofen e autorizada a fazer faculdade no interior de sp detenta pretende cursar administracao de empresas em taubate ela foi condenada a  anos por participar do assassinato dos pais
180562885329138_1191760894209327,191,multas aplicadas a taxistas durante protesto no rio sao suspensas protesto da categoria contra a uber parou a cidade no dia o de abril guarda municipal multou  taxis por infracoes diversas
180562885329138_1191571534228263,1003,nojo diz jovem que relatou em rede social abuso em onibus de curitiba estudante diz que situacao ocorreu na tarde de tercafeira  no parana ela postou foto com saia suja prefeitura afirma que esta dando
180562885329138_1190944004291016,1716,motorista que atropelou e jogou braco de ciclista tem pena reduzida estudante atirou o braco da vitima em um corrego apos o acidente decisao judicial reduziu a pena para dois anos de prisao em regime aberto
180562885329138_1190308347687915,311,suspeito de operar fraude na merenda em sp e liberado apos  dias detido marcel julio estava foragido mas se apresentou a policia na quintafeira  ele e considerado um dos principais operadores do esquema em
180562885329138_1189122394473177,22,multas de transito em sp crescem  em motoristas sofreram  milhoes de multas na capital no ano passado radares autuaram  a mais que em  por desrespeito a semaforo
180562885329138_1188662804519136,565,policial civil que agrediu comerciante iraniano em sp se aposenta investigador jose camilo leonel trabalhava na corregedoria da policia civil policial foi flagrado por cameras apontando arma dentro de loja em sp
180562885329138_1188549977863752,823,lula diz que assume casa civil na quinta se stf aprovar em ato prodilma expresidente disse que pais vive clima de odio  ele afirmou ainda esperar que michel temer aprenda sobre eleicoes
180562885329138_1188453961206687,275,trote de o de abril mobiliza policia e causa correria no centro de vitoria ciodes recebeu denuncia de assalto com refens em uma loja de moveis  segundo gerente loja ja estava fechada quando policiais chegaram
180562885329138_1187522731299810,167,manifestacao de taxistas trava o transito do rio em varios pontos lentidao chegou a  km de extensao acesso ao galeao foi fechado g flagrou varios tumultos durante a manifestacao contra o uber veja
180562885329138_1185185011533582,105,no de multas de velocidade sobe  em ano de adocao de limite de  kmh foram  milhoes em  contra  milhoes em  considerando todas as infracoes recorde chega a  milhoes de multas
180562885329138_1179983375387079,287,justica manda soltar nove presos da a fase da operacao lava jato prazo das prisoes temporarias se encerrou neste sabado  moro diz que vai encaminhar planilha da odebrecht para o stf
180562885329138_1176224139096336,515,homem e preso por fotografar por baixo da saia de mulheres veja video ele foi preso dentro de supermercado em sinop  autor das fotos compartilhava imagens das vitimas no whatsapp diz policia
180562885329138_1174037085981708,8,guia imposto de renda g explica como preencher sua declaracao instrucoes ajudam a preencher todos os campos prazo de entrega da declaracao termina no dia  de abril
180562885329138_1173851632666920,69,em liberdade suspeito de ataques racistas pede desculpas a tais araujo pedro vitor da silva alega que postagens na internet partiram de adolescentes administrador de grupo no facebook estudante foi preso em sertaozinho
180562885329138_1173676226017794,43,reu na lava jato jose carlos bumlai passa a cumprir prisao domiciliar justica converteu prisao preventiva em domiciliar devido a um cancer pecuarista foi preso na a fase da operacao em novembro de
180562885329138_1170761466309270,6306,trf derruba liminar que impedia posse de lula como ministro nesta quinta  trf ja havia suspendido outra decisao contra posse liminar poderia acarretar grave lesao a ordem disse desembargador
180562885329138_1169877626397654,64,tribunal suspende licitacao de obra de conclusao da linha  do metro sessao de abertura de propostas aconteceria nesta quintafeira tce aponta possiveis prejuizos a disputa e pediu esclarecimentos
180562885329138_1167938789924871,112,instagram passara a mostrar primeiro fotos de perfis que voce mais curte ate agora feed de fotos era organizado a partir de postagens recentes esta e a maior mudanca no instagram desde que ele foi lancado em
180562885329138_1167864936598923,24,paes nega ter furado fila em hospital no rio e diz que denuncia e politica sindicato diz que medica foi vitima de assedio moral prefeito negou grosseria dei uma bronca como cidadao
180562885329138_1167851466600270,514,dolar fecha em alta de  a r moeda dos eua avancou   apos ja ter saltado  na vespera mercado repercute chance de lula assumir ministerio
180562885329138_1164937620224988,242,policial que agrediu iraniano em sp diz que usou forca fisica necessaria jose camilo leonel foi indiciado e afirmou que sacou arma para dominalo universitaria que acionou o policial tambem foi indiciada em inquerito
180562885329138_1164220013630082,1428,suzane von richthofen e autorizada a deixar prisao em saida temporaria detenta deve sair da prisao em tremembe nesta sextafeira  esta sera a primeira vez que suzane e beneficiada com a saida temporaria
180562885329138_1163743050344445,920,na espanha juiza pergunta a vitima de abuso se ela fechou as pernas postura de magistrada foi criticada por grupo feminista ela tambem perguntou se havia fechado toda a regiao dos orgaos
180562885329138_1163657973686286,156,medico de sc suspeito de abusar de pacientes e indiciado por  estupros inquerito foi entregue ao ministerio publico na segundafeira  no total sao  vitimas policia reuniu provas para  estupros
180562885329138_1163611420357608,442,estao se achando diz vereador sobre mulheres em discurso no rs parlamentar de capao da canoa disse que mulher foi desgraca do homem video foi compartilhado nas redes sociais e causou revolta de mulheres
180562885329138_1163577443694339,117,anac propoe cancelar bilhete aereo sem custo ate  h depois da compra agencia defendeu mudancas em regras para passageiros e empresas propostas vao passar por consulta publica e depois serao votadas
180562885329138_1162903080428442,86,justica autoriza lula a ter acesso a processos que citam o nome dele expresidente foi um dos alvos da a fase da operacao lava jato defesa solicitou acesso em nome do principio da ampla defesa
180562885329138_1160252970693453,309,dilma rousseff e lula se reunem no apartamento do expresidente no abc encontro em sao bernardo do campo durou pouco mais de uma hora um dia apos depor na lava jato lula desceu para abracar simpatizantes
180562885329138_1157585637626853,1714,promotor diz que lula e marisa nao serao intimados novamente a depor segundo mpsp lula e sua mulher nao serao conduzidos coercitivamente defesa do expresidente prestou esclarecimentos por escrito ao mp
180562885329138_1157291477656269,59,receita comeca hoje a receber declaracao do imposto de renda prazo vai ate  de abril deste ano quem perder paga multa de r
180562885329138_1156953497690067,1867,defesa diz que lula e marisa nao irao comparecer para depor nesta quinta defesa do expresidente prestou esclarecimentos por escrito ao mp  lula deporia nesta quintafeira  em investigacao sobre triplex no guaruja
180562885329138_1156800371038713,559,tarifa sobe de r  para r  no metro do rio em abril reajuste foi publicado nesta segundafeira  no diario oficial onibus taxis e barcas ja tiveram aumento no inicio do ano
180562885329138_1156110011107749,1832,mugabe tem festa de us  mil em area arrasada pela seca no zimbabue comemoracao de presidente no poder ha  anos revolta oposicao lider diz que ocidente condiciona ajuda humanitaria a politica progays
180562885329138_1154845354567548,856,policial que espancou iraniano atirou em duas adolescentes em mae de jovem ferida disse que jose camilo atirou na perna da filha e amiga boletim diz que carro onde estavam jovens disparou corregedoria
180562885329138_1153428921375858,12,apos quase bater no df aviao pegou marqueteiro do pt e o levou ao pr piloto da policia federal ignorou instrucao e invadiu rota de voo da fab aeronautica investiga o ocorrido controlador interveio e evitou choque no
180562885329138_1137554836296600,20,veterinario e proibido de dar consulta gratis e caso gera indignacao na web ricardo fehr camargo atendia de graca aos sabados em sao carlos  postagem repercutiu na internet com mais de  milhoes de visualizacoes
