id,count,value
180562885329138_1219411174777632,85,o trailer de assassins creed traz fassbender na pele de assassino veja filme baseado na franquia de games estreia em  de dezembro deste ano fassbender e homem enviado a inquisicao espanhola para viver assassino
180562885329138_1219573011428115,563,moro diz que e preciso nao ter odio no coracao sobre momento politico declaracao foi feita durante palestra a estudantes e professores no parana no evento na universidade de maringa juiz falou para cerca de mil
180562885329138_1219528358099247,180,papa quer criar comissao de estudo para ordenar diaconisas diaconato e o grau de consagracao anterior ao do sacerdocio  possibilidade ja tinha surgido durante o sinodo dos bispos de
180562885329138_1219282964790453,11,aeronautica marinha e  orgaos abrem prazo para  vagas os salarios chegam r  na prefeitura de piedade   cargos sao em todos os niveis de escolaridade
180562885329138_1219293054789444,2017,ministro gilmar mendes autoriza inquerito para investigar aecio neves tucano e apontado pela pgr como suspeito de irregularidades em furnas senador nega ter cometido irregularidades e diz apoiar investigacao
180562885329138_1219275611457855,66,saiba o que disseram os senadores na votacao do processo de impeachment senado decide se prossegue ou nao com processo de impeachment de dilma cada senador tera direito a se pronunciar por ate  minutos
180562885329138_1219259264792823,1063,processo de impeachment e aberto e dilma e afastada por ate  dias senadores aprovaram instauracao de processo por  votos a  presidente fica afastada por ate  dias enquanto e julgada no senado
180562885329138_1219153671470049,7,o que voce precisa saber para comecar este  de maio de segue votacao no senado sobre a admissao do processo de impeachment petrobras divulga o resultado financeiro apos prejuizo recorde em
180562885329138_1219167618135321,171,discursos proimpeachment atingem numero suficiente para abrir processo ao menos  senadores foram favoraveis ao impeachment e outros  contra senado discute instauracao de processo de impedimento de dilma rousseff
180562885329138_1218964514822298,1282,italia aprova lei que legaliza uniao homossexual parlamento aprovou lei por  votos a  presidente comemorou direito ja existe na maioria dos grandes paises da europa ocidental
180562885329138_1218898914828858,67,whatsapp ganha programa para computadores com mac e windows versao do app de batepapo funciona em mac os x  e windows  servico de mensagem ja podia ser acessado em pcs via navegadores
180562885329138_1218588198193263,48,uber ja foi regulamentado por leis em  regioes pelo mundo incluindo sp sao paulo autorizou por decreto o servico de transporte individual por apps cidade do mexico estado da california e filipinas tambem criaram leis
180562885329138_1218595478192535,133,advogada usa rede social para achar dona de r  mil esquecido em caixa fabiola encontrou dinheiro no caixa eletronico e devolveu a mara farias advogada usou o facebook para localizar a dona do dinheiro
180562885329138_1218625228189560,28, cobertura ao vivo do processo de impeachment da presidente dilma rousseff
180562885329138_1218606008191482,87,no top  do simulado do enem filho de agricultor tenta medicina gabriel pilar presta o enem desde  exaluno de escola publica ele atualmente faz cursinho e usa a plataforma criada pelo mec
180562885329138_1218590131526403,252,papa pede harmonia e paz ao brasil para superar momento de dificuldade essa e a a mensagem do papa francisco sobre situacao politica no brasil declaracao foi feita em audiencia geral realizada no vaticano
180562885329138_1218503094868440,9,veja quais sao as regras das licencas maternidade e paternidade para os homens mudanca de  para  dias e recente para as mulheres beneficio pode ser de ate seis meses
180562885329138_1218484328203650,135,senado inicia nesta quarta sessao para votar processo de impeachment cada senador inscrito tera direito a um pronunciamento de ate  minutos se processo for instaurado presidente dilma e afastada por ate  dias
180562885329138_1218395728212510,7,o que voce precisa saber para comecar este  de maio de senado vota se abre processo de impeachment contra a presidente dilma sao paulo e atleticomg iniciam duelo por vaga na semifinal da libertadores
180562885329138_1217997681585648,1246,estudantes cuidam de ursos de pelucia em acao ludica para criancas projeto hospital do ursinho e organizado por alunos de medicina criancas recebem certificado de coragem depois do tratamento
180562885329138_1218195484899201,814,turistas agora podem entrar no pais com queijo salame e doce de leite nova norma autoriza ingresso de produtos de origem animal na bagagem antes apenas processados de origem vegetal tinham autorizacao
180562885329138_1217881781597238,628,haddad autoriza uber em sao paulo por decreto empresas do novo servico pagarao por km rodado com passageiro  segundo haddad a medida vai beneficiar tambem os taxistas
180562885329138_1217732881612128,105,menina com ossos de vidro tem dia de modelo e participa de ensaio no ac francisca tavares diz que fotos mostram a beleza do deficientes fisicos achei tudo natural diz menina de  anos que vive em rio branco
180562885329138_1217677414951008,2024,alunos criam ponto de alimentacao para caes de rua em medianeira no pr projeto alimentacao inclui local de descanso com wifi para a comunidade iniciativa preve ainda conscientizacao e castracao de animais abandonados
180562885329138_1217616138290469,14,o que voce precisa saber para comecar este  de maio de plenario do senado vota cassacao do mandato de delcidio do amaral deputados do pp discutem expulsao do presidente interino da camara
180562885329138_1217422748309808,100,justica condena acusado de divulgar conteudos nazista e racista na internet antonio donato baudson peret pegou mais de oito anos de prisao ele comecou a ser investigado apos foto polemica ser postada em rede social
180562885329138_1217453428306740,2,noticias para voce terminar este  de maio beminformado emesta lista tem atualizacoes ate o fim do dia acompanheem  o presidente interino da camara waldir maranhao  tentou anular a
180562885329138_1217428374975912,21,ccj da aval para plenario votar cassacao de delcidio do amaral senadores devem votar relatorio nesta tercafeira  conselho de etica recomendou a perda do mandato do exlider do governo
180562885329138_1217335948318488,1824,rihanna anuncia bolsas de estudo de ate  mil dolares para  paises beneficios serao oferecidos a estudantes que quiserem se graduar nos eua inscricoes podem ser feitas ate  de junho brasil esta na lista de paises
180562885329138_1217298364988913,1076,sargento da pm adota crianca que nasceu dentro de viatura crianca foi adotada recem nascida em  samara e um exemplo de vida diz sargento que adotou crianca
180562885329138_1217027778349305,60,foto na web ajuda familia a encontrar morador de rua apos  anos renato luiz tem problemas mentais e vivia em gurupi ha tres ele e de uma familia de nove irmaos que vivem em rondonia
180562885329138_1217201644998585,636,modelo do es destaque no spfw diz que segue como baba e feirante enquanto nao surgir propostas de trabalho ela vai ajudar mae  nao posso deixar a minha mae trabalhando sozinha disse naira lili
180562885329138_1216964451688971,598,irmas gemeas dao a luz na vespera do dia das maes em campo bom rs as irmas ficaram gravidas no mesmo periodo e foram maes no mesmo dia os nascimentos foram presentes de dia das maes dizem paloma e luana
180562885329138_1216622738389809,423,casal realiza sonho e tem festa de casamento com tema de star wars melanie miranda e gabriel silva se casaram em mogi das cruzes recepcao teve convidados com sabre de luz e stormtrooper
180562885329138_1216629625055787,118,em paris pedestres lotam avenida champselysees proibicao de carros sera adotada uma vez por mes para combater poluicao multidao lotou avenida mais famosa da capital francesa em dia de  graus
180562885329138_1216524231732993,19,radiohead lanca na internet o disco a moon shaped pool na ultima sexta grupo lancou clipe de uma das musicas do disco lancamento do album fisico esta previsto para  de junho
180562885329138_1216421918409891,268,aparicao de especie rara de tubarao encanta moradora foi fantastico um dos melhores sabados da minha vida diz dona de casa aliana gomes tubaraobaleia maior peixe do mundo foi visto no mar de angra dos reis
180562885329138_1216398518412231,3, ultimas noticias de economia politica carros emprego educacao ciencia saude cultura do brasil e do mundo videos dos telejornais da tv globo e da globonews
180562885329138_1216363911749025,489,mulheres vencem cancer de colo de utero e realizam sonho de ser mae tratamento realizado no hospital de cancer de barretos reduz infertilidade pacientes curadas tem motivos em dobro para comemorar o dia das maes
180562885329138_1216350215083728,67,catadora tem carroca turbinada por voluntarios em piracicaba ficou linda lucia helena sanches de  anos disse que iniciativa mudou a vida dela instrumento de trabalho foi customizado e entregue a ela no sabado
180562885329138_1216291885089561,1140,casal de mulheres celebra primeiro dia das maes com gemeas no rs filhas sao fruto de fertilizacao in vitro e sao sonho realizado para maes  uma sala nos fundos do consultorio mantem as filhas sempre com elas
180562885329138_1216255708426512,149,mae de gemeos aos  compartilha descobertas da maternidade na web jovem posta videos e fotos na internet e tem mais de  mil seguidores ela deixou sonho de ser comissaria para se dedicar aos filhos
180562885329138_1216158768436206,2090,sou mae por opcao diz mulher que adotou irmaos com paralisia cerebral graca adotou os gemeos ainda bebes e nao sabia do problema no inicio meninos nasceram prematuros e mae biologica morreu no parto
180562885329138_1216152565103493,27,mercurio vai passar na frente do sol nesta segunda entenda o fenomeno transito comeca pouco depois das h nesta segundafeira
180562885329138_1215899061795510,129,vestidos de noivos duplas celebram casamento no fundo do mar na bahia cerimonia ocorreu na manha deste sabado  na praia do porto da barra ato foi promovido por escola de mergulho em salvador
180562885329138_1215733511812065,520,mae realiza sonho e cola grau junto com filho em enfermagem veja video evaldania da costa foi incentivada pelo filho helnatan kleyton filho homenageou a mae com uma faixa durante cerimonia de formatura
180562885329138_1215727548479328,708,cadela com problema cardiaco recebe primeiro marcapasso animal no rs vida sofria desmaios frequentes e passou a ser motivo de preocupacao apos cirurgia aparelho responde a  da atividade cardiaca do animal
180562885329138_1215646718487411,931,muito orgulho diz exseringueira que formou  filhos no acre ou colocava todos na escola ou nao colocava nenhum diz marlene maciel dos  filhos ainda vivos apenas um nao concluiu o ensino superior
180562885329138_1215634048488678,14,acdc inicia hoje turne europeia em lisboa com voz de axl rose sao esperados ate  mil espectadores no passeio maritimo de alges vocalista oficial da banda brian johnson sofre com problemas auditivos
180562885329138_1215481755170574,84,jovem fala sobre o dia das maes ao lado de filha com microcefalia steffany de oliveira  vai ter seu o dia das maes neste domingo  dona de casa teve zika durante gestacao cada dia ha uma vitoria diz
180562885329138_1214761588575924,614,bebes com microcefalia viram elo de belas historias de amor e maternidade maes adotivas das criancas acreditam em destino para elas bebes com malformacao cerebral sao presentes de deus
180562885329138_1214741611911255,177,mae supera limite de idade e se torna colega das filhas na unesp flavia simone estudava de  a  horas por dia para passar no vestibular familia de botucatu apoia estudos e ajuda nas atividades universitarias
180562885329138_1215195698532513,3,noticias para voce terminar este  de maio beminformado emesta lista tem atualizacoes ate o fim do dia acompanheem     o relatorio favoravel a continuidade do impeachment de dilma foi
180562885329138_1215103858541697,97,sadiq khan e eleito o primeiro prefeito muculmano de londres trabalhista de  anos e filho de um motorista de onibus paquistanes ele derrotou o bilionario conservador zac goldsmith
180562885329138_1215047211880695,8256,paciente agradece em guardanapo atendimento de enfermeiro no rs homem de  anos aguarda ha duas semanas por cirurgia ele esta internado no hospital universitario de santa maria
180562885329138_1214947518557331,2664,cao de assistencia de aluno ganha foto em anuario escolar nos eua presley ajuda joseph ware  que tem distrofia muscular garoto disse que demorou  minutos ate cachorro olhar para a camera
180562885329138_1214908725227877,651,foto de ativista negra desafiando sozinha neonazistas se torna simbolo de luta contra racismo imagens de mariateresa tess aslund protestando de punho cerrado contra passeata de grupo de extremadireita em cidade sueca tiveram grande
180562885329138_1214867111898705,154,comissao aprova relatorio favoravel ao prosseguimento do impeachment parecer de antonio anastasia foi aprovado por  votos a favor e  contra agora relatorio sera submetido a votacao no plenario principal do senado
180562885329138_1214811825237567,1027,ja chorei muito por ele diz mae de jovem que nao produz lagrimas joao vitor tem doenca rara e faz tratamento em curitiba assista ao video  jovem tem temperatura corporal de oc e tem intolerancia ao calor
180562885329138_1214782361907180,55,justin timberlake lanca cant stop the feeling ouca a nova musica single faz parte da trilha sonora de trolls animacao da dreamworks clipe tem participacao de gwen stefani anna kendrick e outros assista
180562885329138_1214717428580340,539,multa de transito subira mais de  usar celular sera infracao gravissima dirigir usando o celular passara de infracao media para gravissima punicoes irao de r
180562885329138_1213941271991289,12,ganhei um presente divino diz elza soares sobre o album so de ineditas cantora de  anos fara unica apresentacao em curitiba na sextafeira  lancado em  a mulher do fim do mundo ja e bastante premiado
180562885329138_1214430628609020,7,uncharted  primeiras impressoes jogo do ps combina magia da aventura dramas familiares e acao incrivel uncharted  a thiefs end sera lancado na proxima tercafeira
180562885329138_1214429118609171,318,power rangers revista divulga uniformes de elenco do novo filme cinco adolescentes trocam a lycra por armadura translucida longa dos herois tem previsao de estreia para marco de
180562885329138_1214204865298263,31,usp leva ouro no futebol e no combate em disputa entre robos equipe formada por estudantes da escola politecnica  da usp foi criada ha  anos primeiro ouro internacional foi conquistado na robogames
180562885329138_1214290505289699,942,supremo suspende mandato e afasta  cunha da presidencia da camara plenario confirmou por unanimidade decisao provisoria de teori zavascki ministros entenderam que deputado usava cargo para obstruir lava jato
180562885329138_1214255825293167,8,com gisele e maes de  paises filme busca valorizacao da infancia o comeco da vida estreia nesta quinta  e tem sessoes gratuitas ate domingo familias e especialistas em primeira infancia falam no documentario
180562885329138_1214150811970335,85,axl rose convida fas para show do acdc em portugal veja o video vocalista do guns n roses substitui brian johnson pelo resto da turne grupo de hard rock se apresenta com axl neste sabado  em lisboa
180562885329138_1214035395315210,649,creche tem  pares de gemeos em sc sao seres unicos diz diretora escola de florianopolis ainda tem mais duas duplas a espera de vaga gemeas eduarda e leticia usam tornozeleira para identificacao
180562885329138_1214004078651675,269,ministro do stf afasta cunha do mandato e da presidencia da camara oficial de justica foi a residencia do presidente da camara pela manha decisao liminar acolheu pedido da procuradoriageral da republica
180562885329138_1213992478652835,38,estudantes ocupam assembleia legislativa de sao paulo ha  horas alunos dizem que so sairao do local se for aberta uma cpi da merenda presidente da casa fernando capez pediu reintegracao do local
180562885329138_1213951958656887,2620,ministro do stf afasta cunha do mandato e da presidencia da camara oficial de justica foi a residencia do presidente da camara pela manha decisao liminar acolheu pedido da procuradoriageral da republica
180562885329138_1213933375325412,14,alta procura salva mercado de alimentos saudaveis da crise setor de supermercados aposta que a categoria e a bola da vez mesmo em meio a crise itens com apelo saudavel ganham publico
180562885329138_1213826705336079,1,o que voce precisa saber para comecar este  de maio de supremo julga pedido da rede para afastar cunha da presidencia da camara mega pode pagar r  milhoes de premio no sorteio do concurso
180562885329138_1213354422049974,16,lego star wars o despertar da forca recria filme com irreverencia g jogou novo game traz bom humor e mais formas de usar pecas para construir jogo inspirado no episodio vii de star wars sera lancado em  de junho
180562885329138_1213528935365856,376,solidariedade e amor levam maes de leite a salvar vidas de outros bebes tatiana e isabela sao duas maes que doam leite no recife leite materno doado ajudou benicio a aumentar seu peso de g para kg
180562885329138_1213674338684649,13,noticias para voce terminar este  de maio beminformado emesta lista tem atualizacoes ate o fim do dia acompanheem  strongo presidente da camara eduardo cunha  que pode ser
180562885329138_1213574192027997,1812,stf julgara nesta quinta afastamento de cunha do comando da camara tribunal ira analisar pedido de afastamento protocolado pela rede em dezembro pgr tambem solicitou que supremo afaste cunha da camara
180562885329138_1213499868702096,228,anastasia pede em relatorio que seja instaurado processo de impeachment se plenario aprovar abertura do processo dilma e afastada por ate  dias relator leu parecer na comissao do impeachment que votara na sexta
180562885329138_1213446225374127,2, cobertura ao vivo do processo de impeachment da presidente dilma rousseff
180562885329138_1213372292048187,217,decreto amplia duracao de licencapaternidade para servidores servidores publicos poderao ficar afastados por  dias em vez de cinco servidor beneficiado nao podera exercer nenhuma atividade remunerada
180562885329138_1213230565395693,66,adolescente barrada nos eua e recebida com festa no tocantins anna beatriz estava ha  dias retida em um abrigo de menores apesar do susto a jovem diz que nao vai parar de viajar
180562885329138_1213191362066280,4257,selfie de cao policial em viatura faz sucesso na web apesar do sucesso recente imagem foi feita ha mais de um ano  foto mostra agente doug burgett e cao zurki da delegacia na florida
180562885329138_1213130165405733,2,o que voce precisa saber para comecar este  de maio de relator antonio anastasia  apresenta parecer do impeachment sao paulo corinthians e atleticomg jogam pelas oitavas da libertadores
180562885329138_1212520755466674,1967,pub coloca anuncio em poste e deixa agasalhos gratis pegue um destes dono de bar fez um cabide na porta do local e da desconto para clientes jovem de botucatu faz movimento para realizar festival e arrecadar roupas
180562885329138_1212993942086022,222,janot pede ao stf autorizacao para investigar dilma lula e cardozo procurador questiona nomeacao de lula para ministro que stf suspendeu em notas ministro cardozo  e instituto lula criticaram pedido
180562885329138_1212601178791965,85,meu sonho e oscar afirma atriz com down que concorre no press awards tathi piancastelli quer premio de melhor atriz na edicao do usa  ela descobriu talento quando era crianca e morava em campinas sp
180562885329138_1212949705423779,27,game of thrones e seu incrivel segundo episodio home if gte mso xmloofficedocumentsettingsoallowpngoofficedocumentsettingsxmlendif   if gte mso xmlwworddocumentwview
180562885329138_1212830262102390,82,estudantes invadem plenario da assembleia legislativa de sp cerca de  estudantes ocupam plenario juscelino kubitschek eles pediam uma cpi para investigar a fraude na merenda
180562885329138_1212663772119039,1903,desembargador derruba bloqueio do whatsapp e aplicativo deve voltar justica de sergipe atendeu pedido dos advogados da empresa servico de mensagem foi bloqueado nesta segundafeira
180562885329138_1212533565465393,445,criador do whatsapp nao vamos por a seguranca de  bilhao em risco jan koum falou que bloqueio de app pune milhoes de brasileiros inocentes ele sugeriu que atender pedido judicial compromete seguranca de usuarios
180562885329138_1212486932136723,2268,rejeitado pela mae apos nascer sem pelo bebe ovelha ganha casaco de la para se proteger do frio condicao apresentada pelo cordeiro skippy e muito rara entre especie
180562885329138_1212464865472263,4557,em casa menina que deixou de ser cega se acostuma a claridade com pupila sensivel crianca deve ficar em ambientes mais escuros catarinense nicolly de  anos tem glaucoma e fez cirurgia nos eua
180562885329138_1211698528882230,1339,leoes resgatados de circos sao libertados em parque na africa do sul dos  felinos  estavam em circos do peru e da colombia foi a maior operacao de transporte de felinos em cativeiro da historia
180562885329138_1212232445495505,6,noticias para voce terminar este  de maio beminformado emesta lista tem atualizacoes ate o fim do dia acompanheem  o whatsapp esta bloqueado no brasil desde as h por  horas ele foi
180562885329138_1212007512184665,4634,com enxada estudante homenageia pais em formatura e video viraliza filha de agricultores kauany sousa se formou em servico social estudante e a primeira de quatro irmaos a alcancar o ensino superior
180562885329138_1212120238840059,52,justica determina fim da proibicao de reuniao em faculdade da ufmg liminar que proibia realizacao de assembleia foi suspensa pelo tjmg reuniao iria discutir processo de impeachment de dilma rousseff
180562885329138_1212015545517195,4,enem fuvest e mais veja datas dos vestibulares e das inscricoes usp unesp e unicamp divulgaram informacoes das provas nesta segunda  enem ocorrera nos dias  e  de novembro
180562885329138_1211950682190348,7,em alta esporte invade madrugada e almoco na rotina de universitarios confederacao celebra aumento das competicoes mas cobra incentivo g ouviu amadores que buscam boas notas medalhas e realizacao
180562885329138_1211879902197426,391,janot pede ao stf para investigar aecio cunha e edinho na lava jato tambem quer incluir acusacoes a renan juca e outros da cupula do pmdb pedidos de inquerito se baseiam na delacao do senador delcidio do amaral
180562885329138_1211706038881479,89,noivos de brasilia voam de parapente para chegar ao local do casamento casal esta junto ha  anos cenario escolhido foi rampa de voo livre em go para cerimonia foi providenciado material suficiente para realizar
180562885329138_1211643948887688,2,mais de  concursos abertos reunem  mil vagas em todo o pais cargos sao de todos os niveis de escolaridade salarios chegam a r  no trt do rio grande do sul
180562885329138_1211114472273969,1686,motorista de onibus carrega idosa no colo e faz sucesso na internet veja video com atitude de wilton da dores tem mais de  mil visualizacoes somos humanos e precisamos um do outro diz condutor de sao carlos
180562885329138_1211389008913182,42,primeiro cruzeiro dos eua rumo a cuba em  anos comeca sua viagem o fathom adonia com  passageiros saiu neste domingo  de miami o objetivo e promover intercambio cultural entre os paises
180562885329138_1211350925583657,44,locutor mirim de dois anos e atracao na festa do peao em candeias ro pedro jorge decora versos de rodeio junto com o pai em rondonia menino pode ser o mais jovem locutor de rodeios do brasil diz pai
180562885329138_1211329962252420,3,ue deve seguir com liberacao de visto para turcos nos paises do bloco acao e recompensa por reducao no fluxo de refugiados para a europa parlamento europeu deve aprovar decisao ate o fim de junho
180562885329138_1211136325605117,392,filha de obama tera ano sabatico antes de ir para harvard jovem de  anos deve entrar na universidade apenas em   universidade estimula esse tipo de experiencia
180562885329138_1211139302271486,18,com minima de oc cidade de sp bate novo recorde de frio em esta e a vez em uma semana que a capital tem menor temperatura do ano no extremo sul os termometros marcaram oc na capela do socorro
180562885329138_1210901125628637,3603,as vesperas do o aniversario familia divulga fotos da princesa charlotte charlotte comemora seu primeiro aniversario na segundafeira   ela e irma do principe george e a na linha de sucessao do trono britanico
180562885329138_1210206959031387,402,jovem estuda durante quimio e vai a mundial de robotica minha chance gabriel rodrigues de  anos descobriu cancer antes das competicoes adolescente integra uma equipe do sesi de boituva foi uma vitoria diz
180562885329138_1210594075659342,333,leoes de circo resgatados chegam em sua nova casa na africa do sul o grupo de  leoes foi resgatado de circos no peru e na colombia  eles serao liberados em um santuario na africa do sul
180562885329138_1210556252329791,13,apos reclamacoes mec aumenta prazo para simulado do enem estudantes se queixavam de que nao conseguiam acessar a prova trezentos e cinquenta mil pessoas se inscreveram para o teste
180562885329138_1210458962339520,44,df tem dia d contra gripe neste sabado com drive thru no hran pacientes com dificuldade de locomocao podem se vacinar dentro do carro gdf espera  mil neste sabado meta e imunizar  mil ate  de maio
180562885329138_1210286115690138,3,o que se deve comer antes e depois de fazer exercicios cerca de duas horas antes da academia e aconselhavel comer carboidratos complexos como massas arroz batatas pao e vegetais
