id,count,value
180562885329138_1342070965844985,318,video mais de  bateristas tocam juntos no centro de florianopolis no repertorio cancoes de led zeppelin metallica e white stripes evento gratuito reuniu pessoas de todas as idades neste domingo
180562885329138_1341897279195687,302,ivete sangalo faz show em araraquara e defende liberdade das mulheres e um absurdo disse cantora sobre resultados de pesquisa sobre estupro em entrevista ao g embaixadora da onu falou ainda sobre a paralimpiada
180562885329138_1341793562539392,126,william e kate desembarcam com george e charlotte no canada viagem marca primeira travessia do oceano da cacula da familia com  ano casal real ira percorrer paisagens por  dias criancas ficarao com baba
180562885329138_1341688005883281,16,gil volta aos estudios para gravar a musica que compos para bisneta sol gilberto gil voltou a gravar na ultima quintafeira  de setembro e anunciou a gravacao no mesmo dia na pagina oficial do artista no facebook a
180562885329138_1341067542611994,1133,obama inaugura museu de historia afroamericana em washington ideia surgiu ha mais de  anos mas so foi aprovada em  cerimonia contou com a presenca do cantor stevie wonder
180562885329138_1340997282619020,4878,ganhei nao comprei brinca pai apos nascimento de quadrigemeos bebes nasceram neste sabado  probabilidade segundo medico e de um em cada  mil casos
180562885329138_1340931335958948,781,apos levar neta a hospital de cancer avo decide fazer perucas para doacao morador de boituva doa perucas para hospitais de sorocaba e jau e uma tentativa de diminuir o poder do cancer diz benedito oliveira
180562885329138_1340894085962673,13,teresa canta cartola e caetano sem atravessar o samba em show no rio a cantora carioca teresa cristina canta o repertorio do compositor angenor de oliveira  o cartola desde novembro de  mes em que
180562885329138_1340865562632192,31,so  das matriculas do ensino medio sao em tempo integral no brasil programa do mec preve ajuda de custo para aumentar porcentagem para  ate  em entrevista ao g ministro diz que escolas mais pobres serao priorizadas
180562885329138_1340844165967665,626,the new york times declara apoio a hillary em eleicao nos eua candidata democrata disputa pleito com o rival republicano donald trump para o jornal hillary e mais qualificada para lidar com os problemas do
180562885329138_1340592902659458,13,presos da a fase da lava jato fazem exame no iml em curitiba investigados foram presos na quinta  e estao na carceragem da pf  operacao investiga contratacao de empresas para construir plataformas
180562885329138_1340561189329296,59,campanha de multivacinacao tem dia d neste sabado em todo o pais campanha tem todas as vacinas disponiveis pelo sus ministerio disponibilizou  milhoes de doses extras de  vacinas
180562885329138_1339504839434931,88,estilista arrecada brinquedos para criancas carentes do interior de sp doacoes serao entregues em uma festa no dia das criancas em alambari festa e realizada ha mais de  anos pela familia do estilista sandro barros
180562885329138_1340030292715719,11200,merendeira que concluiu mestrado em rr vira professora universitaria luana coutinho foi aprovada em seletivo da universidade estadual de rr em julho ela concluiu o curso de mestrado enquanto era merendeira
180562885329138_1339707099414705,75,brinquedos dos anos  estampam embalagem de lata de refrigerante embalagens terao estampa de jogos como autorama e genius da estrela edicao sera vendida em sp rj mg e na regiao sul do pais
180562885329138_1339678936084188,2123,flavio bolsonaro quer militarizar escolas mais indisciplinadas do rio candidato do psc concedeu entrevista ao vivo ao g ele tambem comentou sobre financiamento a parada gay
180562885329138_1339418166110265,25543,gabriel o pensador doa r  mil a catador que achou us  mil no lixo joao rodrigues cerqueira devolveu dinheiro a fonoaudiologo em brasilia artista se emocionou com atitude fez vaquinha e visitou homem
180562885329138_1339370619448353,9,como agir na selecao de emprego do curriculo ao posentrevista consultor de rh fala sobre o que impressiona e decepciona selecionadores ficar olhando o relogio ou celular e falar mal de colegas nao pegam bem
180562885329138_1339337576118324,60,secretario da casa civil de mg e alvo de nova fase da operacao acronimo ha mandado de conducao coercitiva contra marco antonio rezende teixeira outros tres mandados de conducao coercitiva foram expedidos
180562885329138_1338995276152554,301,moro e o em lista da bloomberg com os  mais influentes do mundo outro brasileiro e o empresario jorge paulo lemann em o lugar  em primeiro esta a premie britanica theresa may
180562885329138_1338876062831142,781,stf permite que identidade contenha nome do pai afetivo e do biologico relator do caso ministro luiz fux votou em favor de dupla paternidade corte permitiu mudar documento apos reconhecimento de vinculo genetico
180562885329138_1338656236186458,14318,garoto americano de  anos oferece acolher menino sirio em carta a obama atitude rendeu elogios do presidente dos eua mensagem viralizou na internet
180562885329138_1338574406194641,214,moro decreta bloqueio de ate r  milhoes da conta de mantega guido mantega foi preso pela lava jato e teve o mandado revogado outras sete investigados tambem tiveram as contas bloqueadas
180562885329138_1338479862870762,1410,unicamp testa chia e revela beneficios contra cancer diabetes e alzheimer e a a pesquisa que descobriu um poder antioxidante na semente e no oleo chia ja era conhecida por ser nutritiva mas efeitos no corpo sao novidade
180562885329138_1338381649547250,30155,estudante da ufrj comove a internet com declaracao do pai semianalfabeto ela criticou quem debocha das pessoas que nao sabem ler e escrever meu pai nao teve a mesma oportunidade que eu afirmou a jovem
180562885329138_1338300149555400,1181,primavera comeca nesta quinta com ondas de frio previstas ate outubro estacao e caracterizada por maior risco de alergias veja dicas de medica primavera dara lugar ao verao no dia  de dezembro
180562885329138_1338300456222036,327,policia federal cumpre mandados da a fase da operacao lava jato operacao foi deflagrada em sp rj rs mg ba e no distrito federal  exministro guido mantega foi preso temporariamente em sao paulo
180562885329138_1337925969592818,927,pai biologico deve pagar pensao a filha criada por outro decide stf acao tem repercussao geral isto e valera para decisoes de outros tribunais supremo tambem garantiu a filha o direito de heranca do pai biologico
180562885329138_1337673039618111,7356,apos devolver us  mil achados no lixo catador do df ganha emprego ele diz que mesmo vivendo com dificuldade nao cogitou ficar com dinheiro dinheiro havia sido descartado por engano por cunhado de fonoaudiologo
180562885329138_1337673012951447,8,bico quer acabar com subsidio ao transporte para construir universidade candidato a prefeitura de sao paulo do psdc foi o o entrevistado pelo g  ele disse que retirara parte das ciclovias mas nao mexera nas boas
180562885329138_1337627992955949,67,doria diz que se eleito cumprira todo o mandato e nao tentara reeleicao candidato do psdb foi entrevistado pelo g doria disse que nao vai construir creches e que nao e candidato dos ricos
180562885329138_1337333616318720,2974,catador de reciclaveis devolve us  mil encontrados no lixo no df ele diz que mesmo vivendo com dificuldade nao cogitou ficar com dinheiro dinheiro havia sido descartado por engano por cunhado de fonoaudiologo
180562885329138_1337162083002540,1706,pm resgata refem e mata exnamorado que invadiu casa em sp mulher foi mantida em carcere privado por quase h irma foi solta antes dois policiais ficaram feridos na acao e foram atendidos pelos bombeiros
180562885329138_1336880373030711,5587,sergio moro aceita denuncia e lula tornase reu na operacao lava jato expresidente praticou crimes em contratos com a petrobras diz denuncia mulher dele marisa leticia e outros seis tambem se tornaram reus
180562885329138_1336745569710858,25,carmen migueles defende divisao de cargos por criterios tecnicos candidata do partido novo concedeu entrevista ao vivo ao g ela tambem afirmou que pretende transformar favelas em condominios
180562885329138_1335589136493168,109,instituto butantan tera fabrica de vacina de dengue ate fim do ano vacina ainda esta em teste mais  estados comecarao a vacinar voluntarios unidade estara equipada e preparada para producao ate junho de
180562885329138_1335711559814259,36,twitter passa a desconsiderar fotos e videos no limite de  caracteres mudancas foram anunciadas em maio e implementadas nesta segunda  novidades passam a valer ao redor do mundo em navegadores e apps
180562885329138_1335467139838701,1325,ja ouvi muito nao diz expresidiaria que virou empreendedora em poa virginia pereira vende salgados e diz que ja consegue sustentar sua familia  ela foi presa apos assalto em  e agora sonha cursar direito
180562885329138_1335471486504933,77,campanha de multivacinacao comeca nesta segundafeira campanha tera todas as vacinas disponiveis pelo sus ministerio disponibilizou  milhoes de doses extras de  vacinas
180562885329138_1335212109864204,290,emmy  game of thrones e american crime story sao destaques drama de fantasia se tornou maior vencedor da historia com  premios serie sobre o j simpson levou  trofeus veep foi a melhor comedia
180562885329138_1335067446545337,170, cerimonia de premiacao da tv americana acontece neste domingo  galeria com  fotos em pop  arte
180562885329138_1334975243221224,1957,mulheres raspam cabeca para apoiar amiga com cancer em volta redonda isabela ayres de almeida de  anos esta em tratamento desde julho se tiver que raspar mais  vezes a gente vai raspar comenta amiga
180562885329138_1334808263237922,350,solidariedade ajuda hospital de cancer a sanar deficit de r  milhoes eventos beneficentes e doacoes somam  do orcamento da instituicao cerca de  mil atendimentos gratuitos sao feitos por dia em barretos
180562885329138_1334719869913428,229,detento de formiga ve nos estudos oportunidade de mudar de vida com dedicacao diaria ele participou e conquistou bronze na obmep premio tem incentivado o reeducando a ingressar na faculdade
180562885329138_1334710599914355,3210,cadelas de rua sao adotadas e viram frentistas em postos de combustiveis pretinha tem cracha e uniforme ela vigia e faz companhia aos funcionarios noinha e a mais antiga do estabelecimento em divinopolis
180562885329138_1334642883254460,10, ultimas noticias de economia politica carros emprego educacao ciencia saude cultura do brasil e do mundo videos dos telejornais da tv globo e da globonews
180562885329138_1334586599926755,1793,a invencao de um estudante de  anos que pode salvar  milhao de vidas por ano jovem britanico criou um refrigerador de vacinas que tambem pode ser usado para transporte de orgaos doados
180562885329138_1334575973261151,794,ganhando salario minimo faxineiro de suzano mantem trabalhos sociais em  anos mais de  pessoas ja foram atendidas pela ong sciences projeto distribui roupas livros alimentos e visita hospitais asilos e escolas
180562885329138_1334566576595424,19,setor de flores escapa da crise e cresce  ao ano domingo que vem termina a expoflora principal exposicao de flores e plantas ornamentais do pais organizada por produtores de holambra
180562885329138_1334546393264109,12,orgaos abrem inscricoes na segundafeira para  vagas selecoes aceitam inscricoes de todos os niveis de escolaridade os salarios chegam a r  no instituto federal de mt e pe
180562885329138_1334041063314642,81,munique abre sua a oktoberfest sob fortes medidas de seguranca cidade alema promove maior festa dedicada a cerveja do mundo por seguranca foi proibida a entrada com grandes bolsas no recinto
180562885329138_1333864619998953,55,pessoas com deficiencia avaliam mobilidade no parque olimpico modelo paola antonini reclamou de elevadores fora de funcionamento falta de marcacoes no piso dificultou a circulacao de deficientes visuais
180562885329138_1333747086677373,789,madrinhas batizam criancas com cancer com nomes de superherois meninas recebem nomes de flores grupo arrecada doacoes  cerca de  criancas com cancer devem ser presenteadas com campanha
180562885329138_1333717270013688,183,soldada transgenera se torna a mulher a servir na linha de frente do exercito britanico chloe allen de  anos entrou para as forcas armadas como homem mas iniciou tratamento de terapia hormonal e mudou oficialmente seu nome
180562885329138_1333529140032501,1938,exescrava sexual do estado islamico se torna embaixadora da onu jovem iraquiana sobreviveu a sequestro e abusos do grupo extremista ela pede a libertacao de mais de  mil yazidis levadas pelo grupo
180562885329138_1333075333411215,82,series muito boas que merecem uma chance eu sei que todo mundo so fala e ai ja viu a nova temporada de  narcos  ja viu essa tal de  the get down  cade a segunda temporada de
180562885329138_1333078510077564,2,g e rjtv realizam entrevistas com os candidatos a prefeitura do rio no g entrevistas serao ao vivo e terao a participacao dos internautas rjtv falara ao vivo com  candidatos e gravara entrevista com os demais
180562885329138_1332679390117476,747,temer decide vetar integralmente reajuste para defensor publico federal inicialmente ele vetaria reajsute de  e daria um de  mas voltou atras veto integral ao aumento para os servidores foi publicado no diario
180562885329138_1331899616862120,106,pf indicia fernando pimentel e marcelo odebrecht na acronimo ministro do stj autorizou indiciamento material foi enviado para a pgr inquerito viu corrupcao em esquema para liberar financiamentos do bndes
180562885329138_1331761320209283,1376,dono que cometer maustratos nao pode ter novo pet em  anos em sp lei estadual determina perda da guarda a quem agredir animal domestico projeto foi criado apos dona ser flagrada agredindo cadela sara em
180562885329138_1331602710225144,514,bumlai e condenado a  anos de prisao pela lava jato pecuarista esta preso no pr decisao de sergio moro e desta quinta   outros sete reus em um processo da a fase tambem foram condenados
180562885329138_1331582386893843,38,pf deflagra oitava fase da operacao acronimo no df rj sp e mg foram expedidos  mandados judiciais pela a vara federal do df acao apura suposta organizacao criminosa que pagava vantagens indevidas
180562885329138_1330638336988248,7087,vendendo churros a r  por  anos mulher conclui faculdade de direito moradora do df tambem usa dinheiro para bancar escola dos dois filhos homenageada por professor maria odete diz sonhar se tornar promotora
180562885329138_1330039973714751,1336,pitbull conan vigia presos e impede fuga em centro de detencao no para pitbull ajudou a impedir fuga de detentos no distrito de icoaraci cachorro divide a vigilancia do presidio com um cao da raca fila
180562885329138_1330043217047760,333,governo quer arrecadar r  bilhoes com concessoes em governo lancou nesta terca  pacote de concessoes ao setor privado objetivo e estimular a economia e arrecadar recursos para contas publicas
180562885329138_1330028140382601,785,policiais usam burrito para resgatar gatinho preso em tubo de esgoto caso ocorreu no estado americano da california gatinho vai ser adotado por um dos policiais e batizado de burrito
180562885329138_1329983150387100,57,humorista ary toledo tem alta apos internacao em hospital de sp ele passou por um procedimento de cateterismo no sao luiz segundo o hospital tudo correu bem
180562885329138_1329795880405827,467,governo temer anuncia concessao ou venda de  projetos de infraestrutura presidente diz que objetivo e crescimento economico e geracao de emprego estao incluidos aeroportos energia rodovia ferrovias portos e mineracao
180562885329138_1329661173752631,2498,a comovente historia do idoso vendedor de picoles que ganhou mais de r  mil apos campanha online mexicano de  anos vende picoles ha  anos em chicago e teve de abandonar a aposentadoria apos perda da unica filha
180562885329138_1329573273761421,2182, ultimas noticias de economia politica carros emprego educacao ciencia saude cultura do brasil e do mundo videos dos telejornais da tv globo e da globonews
180562885329138_1329453737106708,16, ultimas noticias de economia politica carros emprego educacao ciencia saude cultura do brasil e do mundo videos dos telejornais da tv globo e da globonews
180562885329138_1329229500462465,53,prodigio do piano joey alexander de  anos fala sobre o album com o disco ele foi musico mais jovem indicado a grammy aos  anos pianista de bali minimiza elogios nao acho que sou um genio
180562885329138_1328983647153717,3,app g enem ganha perguntas enigma que dao pontos extras no jogo na reta final de preparacao app tambem tera base de questoes ampliada aplicativo pode ser baixado gratuitamente para ios e android
180562885329138_1328686620516753,1697,casal celebra  anos de uniao e idosa lembra comecou com um sabonete henrique de melo cortejou a mulher com um sabonete apos vaquejada em pe eles tiveram  filhos e moram na mesma casa na zona rural desde
180562885329138_1328738467178235,100,foto rara de machado de assis presidindo a abl e encontrada veja pesquisador divulgou imagem do escritor feita em outubro de  segundo ele este e o unico registro do autor na funcao ja descoberto
180562885329138_1328654630519952,35,carmen lucia toma posse nesta segunda na presidencia do stf ministra tambem chefiara o cnj por dois anos toffoli sera o vice mineira chamou caetano veloso para cantar hino e dispensou festa
180562885329138_1328545520530863,9,concursos com inscricoes abertas tem  mil vagas em todo o pais salarios chegam a r   na procuradoria geral do amazonas sete orgaos abrem prazo para  vagas nesta segunda
180562885329138_1328516153867133,146,camara deve votar cassacao de eduardo cunha nesta segundafeira processo disciplinar comecou a tramitar no conselho de etica ha dez meses expresidente da casa e acusado de mentir sobre contas secretas no
180562885329138_1327896890595726,50,eslovenia tem campeonato de saltos de cachorros veja imagens dos competidores em kamnik
180562885329138_1327631603955588,567,com bicicleta improvisada barbeiro corta cabelos ao ar livre em rio claro lousa em frente ao cemiterio anuncia a barbearia bike ceu azul luis guilherme inacio cobra r  pelo servico oferecido aos clientes
180562885329138_1327702533948495,230,diminuicao do consumo de carne de frango afeta produtores a producao de carne de frango deve apresentar uma queda de  neste ano o globo rural mostra a situacao dos criadores do oeste do parana
180562885329138_1327594950625920,2189,apos  anos casal ainda guarda cartas do comeco do relacionamento emidio fernandes aprendeu a escrever para se comunicar com a esposa apos casamento em  casal de herculandia ficou separado por  ano
180562885329138_1327522540633161,15,como me tornei dama de honra de aluguel americana oferece aconselhamento e servicos de apoio a noivas por pacotes que podem chegar a r  mil
180562885329138_1327593320626083,24,mercado de negocios para a terceira idade foca em idosos independentes nova geracao com mais de  quer ter independencia e aproveitar a vida empresa oferece servicos para quem quer aproveitar a terceira idade
180562885329138_1327519047300177,225,carmen lucia estreia no comando do stf com acoes trabalhistas e sociais beneficio para trabalhadoras e fornecimento de remedios estao na pauta ministra toma posse na segunda mas ja selecionou acoes de quarta e quinta
180562885329138_1327518383966910,734,lewandowski deixa comando do stf nesta segunda veja como foi a gestao coordenacao do impeachment no senado marcou fim do mandato de  anos ministro buscou enfrentar superlotacao das prisoes na atuacao do judiciario
180562885329138_1327033457348736,345,parque olimpico registra recorde de publico neste sabado local recebeu  mil visitantes neste sabado  de paralimpiada recorde era do dia  de agosto durante a olimpiada com  mil pessoas
180562885329138_1326735700711845,64,sete previsoes tecnologicas de star trek que se concretizaram serie dos anos  trazia aparelhos abusrdos para a epoca e que estao no nosso dia a dia
180562885329138_1326526387399443,44,batalha de pokemons analogica atrai jovens da zona leste de sao paulo em meio a febre pokemon go meninos se reunem para jogar com cartas professor da turma angelo silva defende valor pedagogico da brincadeira
180562885329138_1326553390730076,10,veja dicas para reduzir riscos de roubo de moto fique mais atento no inicio e no fim do dia e a motos com  ocupantes viajante experiente diz que mais importante que andar em grupo e planejar
180562885329138_1326516854067063,100,brasileira estilista de burquinis na franca defende peca como liberdade traje usado por muculmanas nas praias foi alvo de polemica na franca marca de brasileira vende modelos de ate r  para mais de  paises
180562885329138_1325773177474764,93,planalto anuncia a advogada grace mendonca para o comando da agu ela sera a primeira mulher no primeiro escalao do governo michel temer mineira grace e servidora de carreira do orgao que faz a defesa do governo
180562885329138_1325610380824377,46,exemplos de superacao motivam publico a prestigiar a paralimpiada espectadores ouvidos pelo g exaltaram a capacidade dos atletas maioria defende ainda a inclusao social das pessoas com deficiencia
180562885329138_1325591710826244,6,roberta spindel parte para mpb folk autoral apos bencao de caetano cantora foi considerada aposta do compositor e prepara novo disco fazer o popular ser fino e incrivel acho que e o caminho diz ela ao g
180562885329138_1325530824165666,93,gatinha entra no livro dos recordes ao fazer  truques em um minuto didga que mora na australia anda ate de skate
180562885329138_1324813214237427,56,bento  diz que acabou com lobby gay e elogia francisco trechos de livro de entrevistas com papa emerito foram divulgados ele nega que pressoes ou escandalos tenham levado a sua renuncia
180562885329138_1325126557539426,50,nasa lanca sonda que viajara ate asteroide para coletar poeira cosmica osirisrex vai ate o asteroide bennu para obter amostras de material rico em carbono que pode ter originado os primeiros seres vivos da terra
180562885329138_1324452470940168,110,grupo faz vaquinha para pagar inscricao da fuvest de alunos pobres e pretos ate a ultima tercafeira grupo havia arrecadado entre r  mil e r  mil para ajudar cerca de  candidatos inscricoes terminam nesta quinta
180562885329138_1324091257642956,508,janot defende aborto para gravidas infectadas pelo virus da zika para procurador aborto se justifica por protecao da saude mental da mulher virus e associado a surto de microcefalia que teve mais de  casos
180562885329138_1324003827651699,1295,relatorio de associacao aponta sc como recordista em doacao de orgaos dados da abto apontam que estado tem maior taxa proporcionalmente levantamento nacional e referente ao primeiro semestre de
180562885329138_1323938927658189,111,gilberto gil recebe alta apos mais de uma semana internado em sp cantor foi internado na tercafeira  no hospital siriolibanes neste periodo ele recebeu a visita de filhas e netos
180562885329138_1323840971001318,413,iphone  iphone  plus e apple watch  sao anunciados veja detalhes iphone perde entrada de fone e resiste a agua  plus tem  cameras atras apple watch  ganha gps nativo relogio tera versao do jogo pokemon go
180562885329138_1323666501018765,245,jornalista hungara que agrediu refugiados e indiciada por vandalismo crime preve pena de ate cinco anos de prisao petra laszlo chutou e deu rasteiras em alguns refugiados
180562885329138_1323617501023665,25,enem e vestibulares veja  temas aplicados na analise do  de setembro data da independencia do brasil pode inspirar perguntas sob varios aspectos no campo das ciencias humanas
180562885329138_1322925611092854,363,post de juiza sobre meritocracia e condicao social viraliza na internet publicacao de fernanda orsomarzo tem mais  mil curtidas mais de  mil pessoas compartilharam a opiniao da juiza do parana
180562885329138_1322831891102226,270,crianca com hidrocefalia e malformacao na coluna vai a escola pela a vez mae havia pensado que ele morreria logo apos o nascimento no inicio noah ira ao colegio uma vez por semana para conciliar com os tratamentos
180562885329138_1322807144438034,223,conselho do mpf prorroga por mais um ano forcatarefa da lava jato prazo para fim da forcatarefa terminaria no dia  de setembro conselho tambem prorrogou trabalhos de grupo que investiga a eletronuclear
180562885329138_1322084264510322,163,usp sobe e alcanca sua melhor posicao na historia de ranking mundial no qs world university ranking  a usp pulou  posicoes e figura na a colocacao mas pelo o ano consecutivo segue atras da universidade de buenos aires
180562885329138_1321677081217707,3341,cachorrinha leal espera por dona durante  dias em porta de hospital caso da maya ocorreu em alicante na espanha e agora ela ficou famosa
180562885329138_1321585981226817,17,arlequinas e mestres pokemon fazem invasao a bgs itens de esquadrao suicida e pokemon go sao os mais comuns na feira cosplayers do game overwatch tambem chamavam a atencao na bgs
180562885329138_1321592297892852,42,paralimpiada tera shows e atividades culturais nos boulevares olimpicos praca maua tera espetaculo de gravidade e exposicao de cadeiras de rodas em campo grande havera show de valesca popozuda e projota
180562885329138_1321055497946532,114,maracana tem ensaio geral da cerimonia de abertura da paralimpiada mensagem de cerimonia e mais universal dizem organizadores paralimpiada comeca nesta quartafeira  transito foi modificado na regiao
180562885329138_1320960731289342,4293,bebe gerado por mae com morte cerebral no es ja pesa  kg gestacao de rosiele pires foi mantida por  dias apos a morte emanuelly nasceu de  semanas mas ja respira sem aparelhos
